Paris 1573,1573,Paris,,LATIN,,"Jean Magnien, Étienne Gracile","EVCLIDIS ELEMENTORVM LIBRI XV. GRAEcè & Latinè,
Quibus, cùm ad omnem Mathematicæ scientiæ partem, tùm ad quamlibet Geometriæ tractationem, facilis comparatur aditus.","THE FIFTEEN BOOKS OF EUCLID'S ELEMENTS. IN GREEK & LATIN,
By which, both to every part of Mathematical science, and to any treatment of Geometry, an easy approach is provided.",EVCLIDIS ELEMENTORVM LIBRI XV.,,,,,EVCLIDIS,,,,,,,,comparatur,"GRAEcè, Latinè",,,,,,,,"ad omnem Mathematicæ scientiæ partem, ad quamlibet Geometriæ tractationem, facilis comparatur aditus",,,yes,1573,"Hieronymum de Marnef, Gulielmum Cauellat",Parisiis,,,,,ai_02_14-55,GRAEcè & Latinè,,"Quibus, cùm ad omnem Mathematicæ scientiæ partem, tùm ad quamlibet Geometriæ tractationem, facilis comparatur aditus",,elements,"Joannes Magnienus, Stephanus Gracilis","Hieronymum de Marnef, Gulielmum Cauellat","Jerome de Marnef, William Cauellat",,"PARISIIS, Apud Hieronymum de Marnef, & Gulielmum Cauellat, sub Pellicano, monte D. Hilarij. 1573.",Octavo,Elements 1–15 (enunciations),the scan includes greek parts that are not transcribed,,https://www.google.co.il/books/edition/Euclidis_Elementorum_libri_15_Graec%C3%A8_La/4D4Px85-r3gC,https://i.imgur.com/8xR0t5w.png,,,"PARIS, At the house of Hieronymus de Marnef, & Gulielmus Cauellat, under the Pelican, on the hill of St. Hilary. 1573."
Urbino 1575,1575,Urbino,,ITALIAN,,"Federico Commandino, Valerio Spacciuoli","DE GLI ELEMENTI D’EVCLIDE LIBRI QVINDICI. CON GLI SCHOLII ANTICHI. TRADOTTI PRIMA IN LINGVA LATINA DA M. FEDERICO COMMANDINO DA VRBINO, &
con Commentarij illustrati, ET HORA D’ORDINE DELL’ISTESSO TRASPORTATI NELLA NOSTRA VVLGAre, & da lui riueduti.","THE ELEMENTS OF EUCLID IN FIFTEEN BOOKS. WITH THE ANCIENT SCHOLIA. FIRST TRANSLATED INTO LATIN BY M. FEDERICO COMMANDINO OF URBINO, &
illustrated with Commentaries, AND NOW BY ORDER OF THE SAME TRANSLATED INTO OUR VERNACULAR, & reviewed by him.",DE GLI ELEMENTI D’EVCLIDE LIBRI QVINDICI,M. FEDERICO COMMANDINO DA VRBINO,,,,D’EVCLIDE,,,,,,,,"TRADOTTI, illustrati, TRASPORTATI, riueduti","LATINA, NOSTRA VVLGAre",,,,,,,,"SCHOLII ANTICHI, Commentarij",,,,M. D. LXXV.,DOMENICO FRISOLINO,VRBINO,"Con licentia de’ Su-
periori.",,,,ai_02_14-55,CON GLI SCHOLII ANTICHI,con Commentarij illustrati,,,elements,"Federigo Commandino, Valerio Spacciuoli",Domenico Frisolino,Domenico Frisolino,"JN VRBINO IN CASA DI FEDERICO COM-MANDINO, CON LICENTIA DE’SVPERIORI. M D LXXV.","CON PRIVILEGIO. JN VRBINO, APPRESSO DOMENICO FRISOLINO. M. D. LXXV. Con licentia de’ Su-
periori.",Folio,Elements 1–15,,,https://www.google.co.il/books/edition/De_gli_elementi_d_Euclides/TchCAAAAcAAJ,https://i.imgur.com/TZ7TxYM.png,,,"WITH PRIVILEGE. IN URBINO, AT THE PRESS OF DOMENICO FRISOLINO. 1575. With permission of the Su- periors."
Venice 1575,1575,Venice,,LATIN,,Francesco Maurolico,"D. FRANCISCI MAVROLYCI, ABBATIS MESSANENSIS,
Opuscula Mathematica; Nunc primùm in lucem ædita, cum rerum omnium notatu dignarum. INDICE LOCVPLETISSIMO. PAG-ELLA HVIC PROXIME CONTIGVA, eorum Catalogus est.","D. FRANCISCI MAVROLYCI, ABBOT OF MESSINA,
Mathematical Works; Now first published, with an index of all noteworthy things. A MOST COMPLETE INDEX. THE PAGE IMMEDIATELY ADJACENT contains the Catalog of them.",Opuscula Mathematica,D. FRANCISCI MAVROLYCI,,ABBATIS MESSANENSIS,,,,,,,,,,ædita,,,,,,,,,"Opuscula Mathematica, INDICE LOCVPLETISSIMO, rerum omnium notatu dignarum",,,,M D L XXV,Franciscum Francis-cium Senensem,Venetijs,CVM PRIVILEGIO,,,,ai_02_14-55,"Nunc primùm in lucem ædita, cum rerum omnium notatu dignarum",,INDICE LOCVPLETISSIMO,"PAG-ELLA HVIC PROXIME CONTIGVA, eorum Catalogus est",elements,Francesco Maurolico,Franciscum Franciscium Senensem,Francesco Franceschi Senese,,"CVM PRIVILEGIO. Venetijs, Apud Franciscum Francis-cium Senensem. M D L XXV.",Quarto,Elements 13–15,,,https://www.google.co.il/books/edition/D_Francisci_Mavrolyci_Abbatis_Messanensi/93xmAAAAcAAJ,https://i.imgur.com/CN2IY5f.png,,,"CVM PRIVILEGIO.  
Venice, At Francis Francis-cius of Siena.  
M D L XXV."
Paris 1578,1578,Paris,,LATIN,,"François de Foix, Comte de Candalle","EVCLIDIS MEGARENSIS MATHEMATICI CLARISSIMI ELEMENTA, LIBRIS XV. AD GERMANAM GEOmetriæ intel-
ligentiam è diuersis lapsibus temporis iniuria contractis restituta, Adimpletis præter maiorum spem, quæ hactenus deerant, solidorum regularium conferentiis ac inscriptionibus. Accessit decimussextus liber, de solidorum regularium sibi inuicem inscriptorum collationibus. Nouissimè collati sunt decimusseptimus & decimusoctauus, priori edi-tione quodammodo polliciti, de componendorum, inscribendorum, & conferendorum compositorum solidorum inuentis, ordine & numero absoluti. AVTHORE D. Francisco Flussate Candalla. AD CAROLVM
IX. CHRISTIANISSIMVM GALLIARVM REGEM.","THE ELEMENTS OF EUCLID OF MEGARA, THE MOST FAMOUS MATHEMATICIAN, IN FIFTEEN BOOKS. RESTORED TO THE TRUE UNDERSTANDING OF GEOMETRY FROM VARIOUS ERRORS CONTRACTED BY THE INJURY OF TIME, WITH ADDITIONS BEYOND THE EXPECTATION OF THE ANCIENTS, WHICH HAVE HITHERTO BEEN LACKING, OF THE DISCUSSIONS AND INSCRIPTIONS OF REGULAR SOLIDS. A SIXTEENTH BOOK HAS BEEN ADDED, ON THE COMPARISONS OF REGULAR SOLIDS INSCRIBED WITHIN EACH OTHER. RECENTLY, THE SEVENTEENTH AND EIGHTEENTH HAVE BEEN ADDED, IN SOME WAY PROMISED IN THE PREVIOUS EDITION, ON THE INVENTIONS, ORDER, AND NUMBER OF COMPOSITE SOLIDS TO BE COMPOSED, INSCRIBED, AND COMPARED. BY THE AUTHOR D. Francisco Flussate Candalla. TO CHARLES IX, THE MOST CHRISTIAN KING OF THE FRANKS.","EVCLIDIS MEGARENSIS MATHEMATICI CLARISSIMI ELEMENTA, LIBRIS XV.",D. Francisco Flussate Candalla.,,,,EVCLIDIS,MEGARENSIS MATHEMATICI CLARISSIMI,,maiorum,"AD CAROLVM
IX. CHRISTIANISSIMVM GALLIARVM REGEM.",,"Nouissimè collati sunt decimusseptimus & decimusoctauus, priori edi-tione quodammodo polliciti, de componendorum, inscribendorum, & conferendorum compositorum solidorum inuentis, ordine & numero absoluti.",,"restituta, Adimpletis, Accessit, collati",,,,,,,,,"solidorum regularium conferentiis ac inscriptionibus, de solidorum regularium sibi inuicem inscriptorum collationibus, de componendorum, inscribendorum, & conferendorum compositorum solidorum inuentis, ordine & numero absoluti",,,,M. D. LXXVIII.,IACOBVM DV PVYS,LVTETIÆ,,,,,ai_02_14-55,"AD GERMANAM GEOmetriæ intel-
ligentiam è diuersis lapsibus temporis iniuria contractis restituta, Adimpletis præter maiorum spem, quæ hactenus deerant, solidorum regularium conferentiis ac inscriptionibus. Accessit decimussextus liber, de solidorum regularium sibi inuicem inscriptorum collationibus.",,"Accessit decimussextus liber, de solidorum regularium sibi inuicem inscriptorum collationibus.",,elements,François de Foix de Candalle,IOANNIS TORNÆSII,Jean de Tournes,"LVGDVNI, EX OFFICINA IOANNIS TORNÆSII, TYPOGRAPHI REGII. M. D. LXXVIII.","LVTETIÆ, APVD IACOBVM DV PVYS. M. D. LXXVIII.",Folio,Elements 1–18,,,https://www.google.co.il/books/edition/Evclidis_Megarensis_Mathematici_Clarissi/TyQSgd8422MC,https://i.imgur.com/TbcU9rz.png,,,"LUTETIAE, AT JACOBUM DU PUYS. 1578."
Cologne 1580,1580,Cologne,,LATIN,,"Jean Magnien, Étienne Gracile","EVCLIDIS ELEMENTORVM LIBRI XV. Quibus, cùm ad
omnem Mathematicæ scientiæ partem, tùm ad quamlibet Geometriæ tractationem, facilis comparatur aditus.","THE FIFTEEN BOOKS OF EUCLID'S ELEMENTS. By which, both to every part of Mathematical science, and to any treatment of Geometry, an easy approach is provided.",EVCLIDIS ELEMENTORVM LIBRI XV,,,,,EVCLIDIS,,,,,,,,comparatur,,,,,,,,,,,,,M. D. LXXX.,Maternum Cholinum,COLONIÆ,Cum Gratia & Priuilegio Cæs. Maiest.,,,,ai_02_14-55,"Quibus, cùm ad
omnem Mathematicæ scientiæ partem, tùm ad quamlibet Geometriæ tractationem, facilis comparatur aditus",,,,elements,"Joannes Magnienus, Stephanus Gracilis",Maternum Cholinum,Maternum Cholinum,,COLONIÆ. Apud Maternum Cholinum. M. D. LXXX. Cum Gratia & Priuilegio Cæs. Maiest.,Octavo,Elements 1–15 (enunciations),,,https://www.google.co.il/books/edition/Elementorum_libri_XV/J8g7AAAAcAAJ,https://i.imgur.com/Z8xaJsu.png,,,COLOGNE. At Maternus Cholinus. 1580. With the Grace & Privilege of the Imperial Majesty.
Venice 1585,1585,Venice,,LATIN,,Niccolò Tartaglia,"EVCLIDE MEGARENSE ACVTISSIMO PHILOSOPHO SOLO INTRODVTTORE DELLE SCIENTIE MATHEMATICE.
DILIGENTEMENTE RASSETTATO, & alla integrità ridotto, per il degno professore di tal Scientie Nicolò Tartalea Brisciano. SECONDO LE  DVE  TRADOTTIONI.  CON  VNA  AMPLA  ESPOSITIONE
DELLO ISTESSO tradottore di nuouo aggionta, talmente chiara, che ogni mediocre ingegno, senza la notitia, ouer suffragio di alcun’altra scientia con facilità serà capace a poterlo intendere. Di nuouo con ogni diligenza ben corretto, e ristampato.","EUCLID OF MEGARA, THE MOST ACUTE PHILOSOPHER, THE ONLY INTRODUCER OF MATHEMATICAL SCIENCES.
DILIGENTLY ARRANGED, & restored to integrity, by the worthy professor of such Sciences Nicolò Tartaglia of Brescia. ACCORDING TO THE TWO TRANSLATIONS. WITH A BROAD EXPOSITION
BY THE SAME translator newly added, so clear, that any average intellect, without the knowledge, or support of any other science, will easily be able to understand it. Newly corrected with every diligence, and reprinted.",EVCLIDE MEGARENSE ACVTISSIMO PHILOSOPHO SOLO INTRODVTTORE DELLE SCIENTIE MATHEMATICE,Nicolò Tartalea,,per il degno professore di tal Scientie,Brisciano,EVCLIDE,MEGARENSE ACVTISSIMO PHILOSOPHO,SOLO INTRODVTTORE DELLE SCIENTIE MATHEMATICE,,,," Di nuouo con ogni diligenza ben corretto, e ristampato.",,"INTRODVTTORE, RASSETTATO, ridotto, tradottore, aggionta, corretto, ristampato",,,,,"ogni mediocre ingegno, senza la notitia, ouer suffragio di alcun’altra scientia",,,,"CON  VNA  AMPLA  ESPOSITIONE, tradottore di nuouo aggionta, talmente chiara, che ogni mediocre ingegno, senza la notitia, ouer suffragio di alcun’altra scientia con facilità serà capace a poterlo intendere.",,none,,M D LXXXV,gli Heredi di Troian Nauo,VENETIA,,,,,ai_02_14-55,,,,,elements,Niccolò Tartaglia,Heredi di Troian Nauo,Heredi di Troian Nauo,,"IN VENETIA, Appresso gli Heredi di Troian Nauo, alla libraria dal Lione. M D LXXXV.",Quarto,Elements 1–15; De levi et ponderoso,,,https://www.google.co.il/books/edition/Euclide_megarense_acutissimo_philosopho/7NV6MduYLhMC,https://i.imgur.com/XFRpBAj.png,,,"IN VENICE, At the Heirs of Troian Nauo, at the Lion's bookstore. 1585."
Venice 1586,1586,Venice,,LATIN,,Niccolò Tartaglia,"EVCLIDE MEGARENSE ACVTISSIMO PHILOSOPHO SOLO INTRODVTTORE DELLE SCIENTIE MATHEMATICE.
DILIGENTEMENTE RASSETTATO, & alla integrità ridotto, per il degno professore di tal Scientie Nicolò Tartalea Brisciano. SECONDO LE  DVE  TRADOTTIONI.  CON  VNA  AMPLA  ESPOSITIONE
DELLO ISTESSO tradottore di nuouo aggionta, talmente chiara, che ogni mediocre ingegno, senza la notitia, ouer suffragio di alcun’ altra scientia con facilità serà capace a poterlo intendere. Di nuouo con ogni diligenza ben corretto, e ristampato.","EUCLID OF MEGARA, THE MOST ACUTE PHILOSOPHER, THE SOLE INTRODUCER OF MATHEMATICAL SCIENCES.
DILIGENTLY ARRANGED, & restored to its integrity, by the worthy professor of such Sciences Nicolò Tartaglia of Brescia. ACCORDING TO THE TWO TRANSLATIONS. WITH A BROAD EXPOSITION
BY THE SAME translator newly added, so clear that any average intellect, without the knowledge, or support of any other science, will easily be able to understand it. Newly corrected with every diligence, and reprinted.",EVCLIDE MEGARENSE ACVTISSIMO PHILOSOPHO SOLO INTRODVTTORE DELLE SCIENTIE MATHEMATICE,Nicolò Tartalea,,per il degno professore di tal Scientie,Brisciano,EVCLIDE,MEGARENSE ACVTISSIMO PHILOSOPHO SOLO INTRODVTTORE DELLE SCIENTIE MATHEMATICE.,,,,,"Di nuouo con ogni diligenza ben corretto, e ristampato.",,"RASSETTATO, ridotto, tradottore, aggionta, corretto, ristampato",,,,,"ogni mediocre ingegno, senza la notitia, ouer suffragio di alcun’ altra scientia con facilità",,,,"VNA  AMPLA  ESPOSITIONE, ESPOSITIONE",,none,,M D LXXXVI,gli Heredi di Troian Nauo,VENETIA,,,,,ai_02_14-55,"DILIGENTEMENTE RASSETTATO, & alla integrità ridotto, per il degno professore di tal Scientie Nicolò Tartalea Brisciano",SECONDO LE  DVE  TRADOTTIONI,"CON  VNA  AMPLA  ESPOSITIONE
DELLO ISTESSO tradottore di nuouo aggionta, talmente chiara, che ogni mediocre ingegno, senza la notitia, ouer suffragio di alcun’ altra scientia con facilità serà capace a poterlo intendere",,elements,Niccolò Tartaglia,Heredi di Troian Nauo,Heredi di Troian Nauo,,"IN VENETIA, Appresso gli Heredi di Troian Nauo, alla libraria dal Lione. M D LXXXVI.",Quarto,Elements 1–15; De levi et ponderoso,,,https://www.google.co.il/books/edition/Evclide_Megarense_Acvtissimo_Philosopho/nMNZAAAAcAAJ,https://i.imgur.com/JLHFpER.png,,,"IN VENICE, At the Heirs of Troian Nauo, at the Lion's bookstore. 1586."
Cologne 1587,1587,Cologne,,LATIN,,"Jean Magnien, Étienne Gracile","EVCLIDIS ELEMENTORVM LIBRI XV. Quibus, cùm ad
omnem Mathematicæ scientiæ partem, tùm ad quamlibet Geometriæ tractationem, facilis comparatur aditus.","THE FIFTEEN BOOKS OF EUCLID'S ELEMENTS. By which, both to every part of Mathematical science, and to any treatment of Geometry, an easy approach is provided.",EVCLIDIS ELEMENTORVM LIBRI XV,,,,,EVCLIDIS,,,,,,,,comparatur,,,,,,,,,,,,,M. D. LXXXVII.,Maternum Cholinum,COLONIAE,Cum Gratia & Priuilegio Cæs. Maiest.,,,,ai_02_14-55,"Quibus, cùm ad
omnem Mathematicæ scientiæ partem, tùm ad quamlibet Geometriæ tractationem, facilis comparatur aditus",,,,elements,"Joannes Magnienus, Stephanus Gracilis",Maternum Cholinum,Maternum Cholinum,,"COLONIAE, Apud Maternum Cholinum.	M. D. LXXXVII. Cum Gratia & Priuilegio Cæs. Maiest.",Octavo,Elements 1–15 (enunciations),,,https://www.google.co.il/books/edition/Euclidis_elementorum_libri_XV/J-ZRAAAAcAAJ,https://i.imgur.com/wIEYUua.png,,,"COLONIAE, At Maternus Cholinus.	M. D. LXXXVII. With the Grace & Privilege of the Emperor's Majesty."
Rome 1594,1594,Rome,,ARABIC,LATIN,Recension of Nasir al-Din al-Tusi,"كتاب تحرير أصول إقليدس من تأليف خواجه نصير الدين الطوسي
EVCLIDIS ELEMENTORVM GEOMETRICORVM Libri Tre-decim.  EX TRADITIONE DOCTISSIMI NASIRIDINI TVSINI
Nunc primum Arabicè impressi.","The Book of the Liberation of Euclid's Elements authored by Khawaja Nasir al-Din al-Tusi
EVCLIDIS ELEMENTORVM GEOMETRICORVM Libri Tre-decim.  EX TRADITIONE DOCTISSIMI NASIRIDINI TVSINI
Now printed in Arabic for the first time.",EVCLIDIS ELEMENTORVM GEOMETRICORVM Libri Tre-decim.,NASIRIDINI TVSINI,,DOCTISSIMI,,EVCLIDIS,,,,,,,,impressi,Arabicè,,,,,,,,,,,,M.D.XCIV.,Typographia Medicea,ROMAE,Cum licentia Superiorum.,,,,ai_02_14-55,,,,,elements,ps-Tusi,Medicea,Medicea,,ROMAE In Typographia Medicea. M.D.XCIV. Cum licentia Superiorum.,Folio,Elements 1–13,,,https://www.google.co.il/books/edition/Kit%C4%81b_ta%E1%B8%A5r%C4%ABr_us%C5%ABl_li_Uql%C4%ABdis_min_t/pEZZAAAAcAAJ,https://i.imgur.com/d3rV7Wd.png,,,IN ROME At the Medicean Press. 1594. With the permission of the Superiors.
Paris 1598,1598,Paris,,LATIN,,"Jean Magnien, Étienne Gracile","EVCLIDIS ELEMENTORVM LIBRI XV. GRAEcè & Latinè,
Quibus, cùm ad omnem Mathematicæ scientiæ partem, tùm ad quamlibet Geometriæ tractationem, facilis comparatur aditus.","THE FIFTEEN BOOKS OF EUCLID'S ELEMENTS. IN GREEK & LATIN,
By which, both to every part of Mathematical science, and to any treatment of Geometry, an easy approach is provided.",EVCLIDIS ELEMENTORVM LIBRI XV.,,,,,EVCLIDIS,,,,,,,,comparatur,"GRAEcè,  Latinè",,,,,,,,"ad omnem Mathematicæ scientiæ partem, ad quamlibet Geometriæ tractationem, facilis comparatur aditus",,,yes,1598,Viduam Guilielmi CAVELLAT,PARISIIS,,,,,ai_02_14-55,GRAEcè & Latinè,,"Quibus, cùm ad omnem Mathematicæ scientiæ partem, tùm ad quamlibet Geometriæ tractationem, facilis comparatur aditus",,elements,"Joannes Magnienus, Stephanus Gracilis",Viduam Guilielmi CAVELLAT,Viduam Guilielmi CAVELLAT,,"PARISIIS, Apud Viduam Guilielmi CAVELLAT, sub Pellicano, monte D. Hilarij. 1598.",Octavo,Elements 1–15 (enunciations),the scan includes greek parts that are not transcribed,,https://www.google.co.il/books/edition/Euclidis_Elementorum_libri_XV_Gr%C3%A6ce_Lat/EsNlAAAAcAAJ,https://i.imgur.com/s86acQR.png,,,"PARIS, At the Widow of William CAVELLAT, under the Pelican, Mount St. Hilary. 1598."
Cologne 1600,1600,Cologne,,LATIN,,"Jean Magnien, Étienne Gracile","EVCLIDIS ELEMENTORVM LIBRI XV. QVIBVS, CVM AD OMNEM MATHEMATICAE SCIENTIAE PARTEM, TVM AD
QVAMLIbet Geometriæ tractationem facilis comparatur aditus.","THE FIFTEEN BOOKS OF EUCLID'S ELEMENTS. BY WHICH, BOTH TO EVERY PART OF MATHEMATICAL SCIENCE, AND TO
ANY Treatment of Geometry, an easy approach is provided.",EVCLIDIS ELEMENTORVM LIBRI XV,,,,,EVCLIDIS,,,,,,,,comparatur,,,,,,,,,,,,,M. D. C.,Gosuinum Cholinum,COLONIAE,Cum Gratia & Privilegio,,,,ai_02_14-55,"QVIBVS, CVM AD OMNEM MATHEMATICAE SCIENTIAE PARTEM, TVM AD
QVAMLIbet Geometriæ tractationem facilis comparatur aditus",,,,elements,"Joannes Magnienus, Stephanus Gracilis",Gosuinus Cholinus,Gosuinus Cholinus,,COLONIAE Apud Gosuinum Cholinum M. D. C. Cum Gratia & Privilegio.,Octavo,Elements 1–15 (enunciations),,,https://www.google.co.il/books/edition/Evclidis_Elementorvm_Libri_XV/EN9RAAAAcAAJ,https://i.imgur.com/iPXqTmJ.png,,,COLONIAE At Gosuinus Cholinus M. D. C. With Grace & Privilege.
Cologne 1602,1602,Cologne,,LATIN,,"François de Foix, Comte de Candalle","EVCLIDIS MEGARENSIS MATHEMATICI CLARISSIMI ELEMENTA, LIBRIS XV. AD GERMANAM GEOMETRIAE INTELLIGENTIAM, E DIVERSIS LAPSIBVS TEMPORIS INIVRIA CONTRACTIS RESTITUTA, ADIMPLETIS PRAETER
MAIORVM SPEM, QUAE HACTEnus deerant, solidorum regu-larium conferentijs ac inscriptionibus. Accessit decimussextus liber, ac solidorum regularium sibi inuicem inscriptorum collationibus. Nouissimè collati sunt decimusseptimus & decimusoctauus, priori editioni quodammodo polliciti, de componendorum, inscribendo-rum, & conferendorum compositorum solidorum inuentis, ordine & numero absoluti. AVTHORE D. FRANCISCO FLVSSATE CAN-DALLA. AD CAROLVM IX. CHRISTIANISSIMVM GALLIARVM
REGEM.","THE ELEMENTS OF EUCLID OF MEGARA, THE MOST FAMOUS MATHEMATICIAN, IN FIFTEEN BOOKS. RESTORED TO THE TRUE UNDERSTANDING OF GEOMETRY, FROM VARIOUS ERRORS CONTRACTED THROUGH THE INJURY OF TIME, FULFILLED BEYOND THE HOPE OF THE ANCIENTS, WITH THE ADDITION OF THE COMPARISONS AND INSCRIPTIONS OF REGULAR SOLIDS WHICH WERE HITHERTO LACKING. THE SIXTEENTH BOOK HAS BEEN ADDED, WITH COMPARISONS OF REGULAR SOLIDS INSCRIBED WITHIN EACH OTHER. MOST RECENTLY, THE SEVENTEENTH AND EIGHTEENTH HAVE BEEN ADDED, IN SOME WAY PROMISED IN THE PRIOR EDITION, COMPLETED IN ORDER AND NUMBER, ON THE INVENTIONS OF COMPOSING, INSCRIBING, AND COMPARING COMPOSITE SOLIDS. BY THE AUTHOR D. FRANCISCO FLUSSATE CANDALLA. TO CHARLES IX, THE MOST CHRISTIAN KING OF THE FRENCH.","EVCLIDIS MEGARENSIS MATHEMATICI CLARISSIMI ELEMENTA, LIBRIS XV.",D. FRANCISCO FLVSSATE CAN-DALLA.,,,,EVCLIDIS,MEGARENSIS MATHEMATICI CLARISSIMI,,MAIORVM,"AD CAROLVM IX. CHRISTIANISSIMVM GALLIARVM
REGEM.",,"Nouissimè collati sunt decimusseptimus & decimusoctauus, priori editioni quodammodo polliciti, de componendorum, inscribendo-rum, & conferendorum compositorum solidorum inuentis, ordine & numero absoluti.",,"RESTITUTA, Accessit, collati",,,,,,,,,"solidorum regu-larium conferentijs ac inscriptionibus, solidorum regularium sibi inuicem inscriptorum collationibus, de componendorum, inscribendo-rum, & conferendorum compositorum solidorum inuentis, ordine & numero absoluti",,,,1602,,COLONIAE VBIORVM,,,,,ai_02_14-55,"AD GERMANAM GEOMETRIAE INTELLIGENTIAM, E DIVERSIS LAPSIBVS TEMPORIS INIVRIA CONTRACTIS RESTITUTA, ADIMPLETIS PRAETER
MAIORVM SPEM, QUAE HACTEnus deerant, solidorum regu-larium conferentijs ac inscriptionibus.",,"Accessit decimussextus liber, ac solidorum regularium sibi inuicem inscriptorum collationibus.",,elements,François de Foix de Candalle,IOANNIS TORNÆSII,IOANNIS TORNÆSII,"LVGDVNI, EX OFFICINA IOANNIS TORNÆSII, TYPOGRAPHI REGII. M. D. LXXVIII.","COLONIAE VBIORVM, ANNO 1602.",Folio,Elements 1–18,,,https://www.google.co.il/books/edition/Elementa/AJdpAAAAcAAJ,https://i.imgur.com/AszQ7mZ.png,,,"COLOGNE, IN THE YEAR 1602."
Paris 1602,1602,Paris,,LATIN,,"François de Foix, Comte de Candalle","EVCLIDIS MEGARENSIS MATHEMATICI CLARISSIMI ELEMENTA, LIBRIS XV. AD GERMANAM GEOMETRIAE INTELLIGENTIAM, E DIVERSIS LAPSIBVS TEMPORIS INIVRIA CONTRACTIS RESTITVTA, ADIMPLETIS PRAETER
MAIORVM SPEM, QVAE HACTEnus deerant, solidorum regu-larium conferentijs ac inscriptionibus. Accessit decimussextus liber, ac solidorum regularium sibi inuicem inscriptorum collationibus. Nouissimè collati sunt decimusseptimus & decimusoctauus, priori editioni quodammodo polliciti, de componendorum, inscribendo-rum, & conferendorum compositorum solidorum inuentis, ordine & numero absoluti. AVTHORE D. FRANCISCO FLVSSATE CAN-DALLA. AD CAROLVM IX. CHRISTIANISSIMVM GALLIARVM REGEM.","THE ELEMENTS OF EUCLID OF MEGARA, A MOST ILLUSTRIOUS MATHEMATICIAN, IN FIFTEEN BOOKS. RESTORED TO THE TRUE UNDERSTANDING OF GEOMETRY, FROM VARIOUS ERRORS CONTRACTED THROUGH THE INJURY OF TIME, FULFILLED BEYOND THE HOPE OF OUR ANCESTORS, WITH THE ADDITION OF WHAT WAS HITHERTO LACKING, THE COMPARISONS AND INSCRIPTIONS OF REGULAR SOLIDS. A SIXTEENTH BOOK HAS BEEN ADDED, WITH COMPARISONS OF REGULAR SOLIDS INSCRIBED WITHIN EACH OTHER. RECENTLY, THE SEVENTEENTH AND EIGHTEENTH HAVE BEEN ADDED, IN SOME WAY PROMISED IN THE EARLIER EDITION, COMPLETED IN ORDER AND NUMBER ON THE INVENTIONS OF COMPOSING, INSCRIBING, AND COMPARING COMPOSITE SOLIDS. BY THE AUTHOR D. FRANCISCO FLUSSATE CANDALLA. TO CHARLES IX, THE MOST CHRISTIAN KING OF THE FRANKS.","EVCLIDIS MEGARENSIS MATHEMATICI CLARISSIMI ELEMENTA, LIBRIS XV.",D. FRANCISCO FLVSSATE CAN-DALLA.,,,,EVCLIDIS,MEGARENSIS MATHEMATICI CLARISSIMI,,MAIORVM,AD CAROLVM IX. CHRISTIANISSIMVM GALLIARVM REGEM.,,"Nouissimè collati sunt decimusseptimus & decimusoctauus, priori editioni quodammodo polliciti, de componendorum, inscribendo-rum, & conferendorum compositorum solidorum inuentis, ordine & numero absoluti.",,"RESTITVTA, Accessit, collati",,,,,,,,,"solidorum regu-larium conferentijs ac inscriptionibus, solidorum regularium sibi inuicem inscriptorum collationibus, de componendorum, inscribendo-rum, & conferendorum compositorum solidorum inuentis, ordine & numero absoluti",,,,ANNO 1602,,LVTETIAE PARISIORVM,,,,,ai_02_14-55,"AD GERMANAM GEOMETRIAE INTELLIGENTIAM, E DIVERSIS LAPSIBVS TEMPORIS INIVRIA CONTRACTIS RESTITVTA, ADIMPLETIS PRAETER
MAIORVM SPEM, QVAE HACTEnus deerant, solidorum regu-larium conferentijs ac inscriptionibus.",,"Accessit decimussextus liber, ac solidorum regularium sibi inuicem inscriptorum collationibus.",,elements,François de Foix de Candalle,IOANNIS TORNÆSII,IOANNIS TORNÆSII,"LVGDVNI, EX OFFICINA IOANNIS TORNÆSII, TYPOGRAPHI REGII. M. D. LXXVIII.","LVTETIAE PARISIORVM, ANNO 1602.",Folio,Elements 1–18,,-,,,,,"PARIS OF THE PARISIANS, YEAR 1602."
Arnhem 1603,1603,Arnhem,,LATIN,,Christoffer Dybvad,"C. DIBVADII IN GEOMETRIAM EVCLIDIS prioribus sex
Elementorum libris comprehensam Demonstratio Linealis.	AD CHRISTIANVM IV. Serenissimum Daniæ & Septentrionis Regem.","C. LINEAR DEMONSTRATION OF THE GEOMETRY OF EUCLID contained in the first six books of the Elements. TO CHRISTIAN IV, Most Serene King of Denmark & the North.","GEOMETRIAM EVCLIDIS prioribus sex
Elementorum libris comprehensam Demonstratio Linealis",C. DIBVADII,,,,EVCLIDIS,,,,AD CHRISTIANVM IV. Serenissimum Daniæ & Septentrionis Regem.,,,,,,,,,,,,,,,"prioribus sex
Elementorum libris",,M. D. C. III.,IOHANNEM IAN-SONIVM,ARNHEMII GELDRIÆ,,,,,ai_02_14-55,"prioribus sex
Elementorum libris comprehensam Demonstratio Linealis",,,,elements,Christoffer Dybvad,IOHANNEM IAN-SONIVM,Johannes Janssonius,,"ARNHEMII GELDRIÆ, Apud IOHANNEM IAN-SONIVM. M. D. C. III.",Quarto,Elements 1–6,,,https://www.google.co.il/books/edition/C_Dibvadii_In_Geometriam_Evclidis_priori/xHQ8AAAAcAAJ,https://i.imgur.com/R3LCIBk.png,,,"ARNHEM IN GELDERLAND, At IOHANNES JANSEN. 1603."
Arnhem 1605a,1605,Arnhem,,LATIN,,Christoffer Dybvad,"C. DIBVADII IN ARITHMETICAM IRRATIONALIVM EV-
CLIDIS Decimo Elementorum libro comprehensam Demonstratio Linealis & Numeralis. AD HENRICVM Walliæ Principem; Regno-rumque Britanniæ Magnæ, Franciæ & Hyberniæ heredem.","C. A LINEAR & NUMERICAL DEMONSTRATION OF EUCLID'S ARITHMETIC OF THE IRRATIONALS
CONTAINED IN THE TENTH BOOK OF THE ELEMENTS. TO HENRY, Prince of Wales; and heir to the Kingdoms of Great Britain, France & Ireland.",ARITHMETICAM IRRATIONALIVM EV- CLIDIS Decimo Elementorum libro comprehensam Demonstratio Linealis & Numeralis,C. DIBVADII,,,,EVCLIDIS,,,,"AD HENRICVM Walliæ Principem; Regno-rumque Britanniæ Magnæ, Franciæ & Hyberniæ heredem.",,,,,,,,,,,,,,,Decimo Elementorum libro,,ANNO M. D. C. V.,IOHANNEM IAN-SONIVM,ARNHEMII GELDRIÆ,,,,,ai_02_14-55,,,,,elements,Christoffer Dybvad,Johannem Iansonium,Johannes Janssonius,,"ARNHEMII GELDRIÆ, Apud IOHANNEM IAN-SONIVM. ANNO M. D. C. V.",Quarto,Elements 10,,-,https://www.google.co.il/books/edition/C_Dibvadii_in_arithmeticam_irrationalivm/gMI2AAAAMAAJ,https://i.imgur.com/M6AMhfs.png,,,"ARNHEM IN GELDERLAND, At IOHANNES JAN-SONIUS. YEAR 1605."
