Amsterdam 1634,1634,Amsterdam,,GERMAN,LATIN,"Jan Pieterszoon Dou, Sebastian Curtius","Die sechs ersten Bücher EVCLIDIS, Dess hochgelährten weit-berümbten, Griechischen Philosophi vnd Mathematici: Von den Anfängen vnd fundamenten der Geometriæ. Dabey dann mancherley auss diesen Büchern gezogene Nutzbarkeiten angefüget seind: sampt den Speciebus in Geometrischen Figuren, alss machen, verändern,
zusammenfügen, abziehen, vielfältigen vnd theilen: Per Demonstra-tiones Lineales. Auss H. Ioann Petersz Dou Niderländischen andern Edition verteutscht, Durch Sebastianum Curtium, Arithmeticum &
G. Verordneten Inspectorn vnd Visitatorn der Teuschen Schuln in Nürnberg.","The first six books of EUCLID, The highly learned and renowned Greek Philosopher and Mathematician: On the beginnings and foundations of Geometry. Along with various utilities drawn from these books: together with the species in geometric figures, such as making, altering, combining, subtracting, multiplying, and dividing: Through Linear Demonstrations. Translated from Mr. Ioann Petersz Dou's Dutch second edition, By Sebastian Curtius, Arithmetician &
G. Appointed Inspector and Visitor of the German Schools in Nuremberg.",Die sechs ersten Bücher EVCLIDIS,Sebastianum Curtium,,Arithmeticum & G. Verordneten Inspectorn vnd Visitatorn der Teuschen Schuln in Nürnberg.,,EVCLIDIS,"Dess hochgelährten weit-berümbten, Griechischen Philosophi vnd Mathematici",,H. Ioann Petersz Dou,,,Auss H. Ioann Petersz Dou Niderländischen andern Edition verteutscht,,"verteutscht, angefüget","Niderländischen, verteutscht",,,,,,,Teuschen Schuln in Nürnberg,"mancherley auss diesen Büchern gezogene Nutzbarkeiten, Speciebus in Geometrischen Figuren, alss machen, verändern, zusammenfügen, abziehen, vielfältigen vnd theilen, Per Demonstra-tiones Lineales",,,,1634,Ioann Iansz,Amsterdam,,,,,ai_02_14-55,Von den Anfängen vnd fundamenten der Geometriæ,,"Dabey dann mancherley auss diesen Büchern gezogene Nutzbarkeiten angefüget seind: sampt den Speciebus in Geometrischen Figuren, alss machen, verändern, zusammenfügen, abziehen, vielfältigen vnd theilen: Per Demonstra-tiones Lineales",,elements,"Jan Pieterszen Dou, Sebastian Curtius",Ioann Iansz,Ioann Iansz,,Gedruckt zu Amsterdam bey Ioann Iansz. Im Jahr 1634.,Octavo,Elements 1–6,,2022211,http://digital.slub-dresden.de/id46912878X,https://i.imgur.com/S8YBJAD.jpeg,,,Printed in Amsterdam by Ioann Iansz. In the year 1634.
London 1686,1686,London,,ENGLISH,,Isaac Barrow,"EVCLID’s ELEMENTS. The Whole FIFTEEN BOOKS Com- pendiously Demonstrated By Mr. ISAAC BARROW, Fellow of Trin-ity Colledge in CAMBRIDGE. And Translated out of the Latin. The Second Edition, very carefully corrected.",,EVCLID’s ELEMENTS,ISAAC BARROW,,Mr.,Fellow of Trin-ity Colledge in CAMBRIDGE,EVCLID,,,,,,"Second Edition, very carefully corrected",,"Demonstrated, Translated, corrected",Latin,,,,,,,Trin-ity Colledge in CAMBRIDGE,,,,,MDCLXXXVI,"Christopher Hussey, E. P.",LONDON,,,,,ai_02_14-55,The Whole FIFTEEN BOOKS Com- pendiously Demonstrated,Translated out of the Latin,,,elements,Isaac Barrow,Christopher Hussey and E. P.,Christopher Hussey and E. P.,,LONDON: Printed for Christopher Hussey and E. P. in Lit-tle Britain. MDCLXXXVI.,Duodecimo,Elements 1–15,,,,https://i.imgur.com/OHWjwXb.jpeg,,,
London 1660,1660,London,,ENGLISH,,Isaac Barrow,EUCLIDE’S ELEMENTS; The whole Fifteen Books compen-diously Demonstrated By Mr. ISAAC BARROW Fellow of Trinity Colledge in CAMBRIDGE. And Translated out of the Latin.,,EUCLIDE’S ELEMENTS,ISAAC BARROW,,Mr.,Fellow of Trinity Colledge in CAMBRIDGE,EUCLIDE,,,,,,,,"Demonstrated, Translated",Latin,,,,,,,Trinity Colledge in CAMBRIDGE,,,,,1660,"R. DANIEL, WILLIAM NEALAND","LONDON, Cambridge",,,,,ai_02_14-55,The whole Fifteen Books compen-diously Demonstrated,Translated out of the Latin,,,elements,Isaac Barrow,WILLIAM NEALAND,WILLIAM NEALAND,,"LONDON, Printed by R. DANIEL, for WILLIAM NEALAND Bookseller in Cambridge; and are to be sold there, and at the Crown in Duck-Lane, 1660.",Octavo,Elements 1–15,ustc: https://www.ustc.ac.uk/editions/3078383,,,https://i.imgur.com/58jZfBm.png,,,
Amsterdam 1618,1618,Amsterdam,,GERMAN,,"Jan Pieterszen Dou, Sebastian Curtius","Die sechs ersten Bücher EVCLIDIS, Desz höchgelärten weit-berümbten, Griechischen Philosophi und Mathematici: Von den anfängen vnd fundamenten der Geometriæ. Dabey dann mancherley auss disen Büchern gezogene nutzbarkeiten angefüget seind: sampt den Speciebus inn Geometrischen figurn, als machen, verändern, zusammenfügen, abziehen, vielfältigen vnnd theilen: Per Demonstra-tiones Lineales. Auss H. Ioann Petersz Dou. Niderlandischen andern Edition verteutscht, Durch Sebastianum Curtium, Arithmeticum &
G. Verordneten Inspectorn vnd Visitatorn der Teütschen Schuln in Nurnberg.","The first six books of EUCLID, the highly learned and renowned Greek philosopher and mathematician: On the beginnings and foundations of Geometry. Along with various utilities drawn from these books: together with the species in geometric figures, such as making, altering, combining, subtracting, multiplying, and dividing: Through Linear Demonstrations. Translated from Mr. Ioann Petersz Dou's Dutch second edition, by Sebastian Curtius, Arithmetician &
G. Appointed Inspector and Visitor of the German Schools in Nuremberg.",Die sechs ersten Bücher EVCLIDIS,Sebastianum Curtium,,Arithmeticum & G. Verordneten Inspectorn vnd Visitatorn der Teütschen Schuln in Nurnberg.,,EVCLIDIS,"Desz höchgelärten weit-berümbten, Griechischen Philosophi und Mathematici",,H. Ioann Petersz Dou.,,,,,verteutscht,Niderlandischen,,,,,,,Verordneten Inspectorn vnd Visitatorn der Teütschen Schuln in Nurnberg,"mancherley auss disen Büchern gezogene nutzbarkeiten, den Speciebus inn Geometrischen figurn, als machen, verändern, zusammenfügen, abziehen, vielfältigen vnnd theilen, Per Demonstra-tiones Lineales",,,,1618,Wilhelm Janss.,Amsterdam,,,,,ai_02_14-55,Niderlandischen andern Edition,,"Dabey dann mancherley auss disen Büchern gezogene nutzbarkeiten angefüget seind: sampt den Speciebus inn Geometrischen figurn, als machen, verändern, zusammenfügen, abziehen, vielfältigen vnnd theilen: Per Demonstra-tiones Lineales",,elements,"Jan Pieterszen Dou, Sebastian Curtius",Wilhelm Janss,Wilhelm Janss,,Gedruckt zu Amsterdam bey Wilhelm Janss. 1618.,Quarto,Elements 1–6,,,https://www.google.co.il/books/edition/Die_sechs_ersten_B%C3%BCcher_Euclidis/s-pZAAAAcAAJ,https://i.imgur.com/doOty6f.png,,,Printed in Amsterdam by Wilhelm Janss. 1618.
Venice 1482,1482,Venice,,LATIN,,Erhard Ratdolt,?,,,,,,,,,,,,,,,,,,,,,,,,,,,,,,,,,,,mia,,,,,elements,Ratdolt,Erhardus Ratdolt,Erhard Ratdolt,Opus elementorum euclidis megarensis in geometriam artem In id quoque Campani perspicacissimi Commentationes finiunt. Erhardus ratdolt Augustensis impressor solertissimus. venetijs impres-sit. Anno salutis. M.cccc.lxxxij. Octauis. Calen. Iun. Lector. Vale.,,Folio,Elements 1–15,Vinci marked author as Campano,,https://drive.google.com/file/d/1gPwewiz3rz-rdWE9BfDxXSwBDIkCMsHi/view?usp=drive_link,,,,
Arnhem 1605,1605,Arnhem,,LATIN,,Christoffer Dybvad,"C. DIBVADII IN ARITHMETICAM IRRATIONALIVM EV-
CLIDIS Decimo Elementorum libro comprehensam Demonstratio Linealis & Numeralis. AD HENRICVM Walliæ Principem; Regno-rumque Britanniæ Magnæ, Franciæ & Hyberniæ heredem.","C. A LINEAR & NUMERICAL DEMONSTRATION OF EUCLID'S ARITHMETIC OF THE IRRATIONALS
Contained in the Tenth Book of the Elements. TO HENRY, Prince of Wales; and heir to the Kingdoms of Great Britain, France & Ireland.",ARITHMETICAM IRRATIONALIVM EV- CLIDIS Decimo Elementorum libro comprehensam Demonstratio Linealis & Numeralis,C. DIBVADII,,,,EV- CLIDIS,,,,"AD HENRICVM Walliæ Principem; Regno-rumque Britanniæ Magnæ, Franciæ & Hyberniæ heredem.",,,,,,,,,,,,,,,Decimo Elementorum libro,,ANNO M. D. C. V.,IOHANNEM IAN-SONIVM,ARNHEMII GELDRIÆ,,,,,ai_02_14-55,,,,,elements,Christoffer Dybvad,,,,"ARNHEMII GELDRIÆ, Apud IOHANNEM IAN-SONIVM. ANNO M. D. C. V.","CLIDIS Septimo, Octavo & Nono Elementorum libris comprehen-sam Demonstratio",AD IACOBVM I,,-,https://www.google.co.il/books/edition/C_Dibvadii_in_arithmeticam_irrationalivm/gMI2AAAAMAAJ,https://i.imgur.com/RtD0CCV.png,,,"ARNHEM IN GELDERLAND, At JOHANNES JAN-SONIUS. YEAR 1605."
Vicenza 1491,1491,Vicenza,,LATIN,,Leonardo Achati,?,The most illustrious book of Euclid's most perceptive elements: in the art of Geometry begins most happily:,Preclarissimus liber elementorum Euclidis,,,,,Euclidis,perspicacissimi,,,,,,,incipit,,,,,,,,,,,,,,,,,,,,mia,perspicacissimi,,in artem Geometrie incipit quamfœlicissime,,elements,Achates,,,Opus elementorum euclidis megarensis in geometriam artem In id quoque Campani perspicacissimi Commentationes fini-unt. Impresum Vincentiæ per Magistrum Leonardum de Basilea & Gulielmum de Papia Socios. Anno salutis M.cccclxxxxi. Vigesimo. Calen. Iunius. Lector. Vale.,,Folio,Elements 1–15,"We don't have the title page, and from the wording of the title we do have, I suspect there is no title page� The EiP title is:  Preclarissimus liber elementorum Euclidis perspicacissimi: in artem Geometrie incipit quamfœlicissime:",,,,,,
Venice 1498a,1498,Venice,,LATIN,,Giorgio Valla,"Georgio Valla Placentino Interprete.

Hoc in volumine hec continentur
Nicephori logica
Georgii Valle libellus de argumentis
Euclidis quartus decimus elementorum
Hypothesis interpretatio eiusdem libri Euclidis
Nicephorus de astrolabio
Proclus de astrolabio
Aristarchi Sami de magnitudinibus
et distantijs solis et lune
Timeus de mundo
Cleonidis musica
Eusebii Pamphili de quibusdam
theologicis ambiguitatibus
Cleomedes de mundo
Athenagorae philosophi de resurrectione
Aristotelis de celo
Aristotelis magna ethica
Aristotelis ars poetica
Rhazes de pestilentia
Galenus de inaequali intemperantia
Galenus de bono corporis habitu
Galenus de confirmatione corporis humani
Galenus de pestigura
Galenus de pestagio
Zalchi introductiorium
Galenus de succidanéis
Alexander Aphrodiseus de causis ebriorum
Platus de victu humano.","Giorgio Valla of Piacenza, Translator.

In this volume the following are contained
Nicephorus on logic
A small book by Giorgio Valla on arguments
The fourteenth book of Euclid’s Elements
An interpretation of the same book of Euclid on physics
Nicephorus on the astrolabe
Proclus on the astrolabe
Aristarchus of Samos on the sizes
and distances of the sun and moon
Timaeus on the world
Cleonides on music
Eusebius Pamphili on certain
theological ambiguities
Cleomedes on the world
Athenagoras the philosopher on the resurrection
Aristotle on the heavens
Aristotle’s Magna Ethica
Aristotle’s Poetics
Rhazes on pestilence
Galen on unequal intemperance
Galen on the good condition of the body
Galen on the strengthening of the human body
Galen on pestilence
Galen on the plague
Zalchi’s introduction
Galen on purgatives
Alexander of Aphrodisias on the causes of drunkenness
Plato on human diet",,Georgio Valla,Georgii Valle,Placentino Interprete,,"Euclidis, euclidis",,,"Nicephori, Nicephorus, Proclus, Aristarchi Sami, Cleonidis, Eusebii Pamphili, Cleomedes, Athenagorae philosophi, Aristotelis, Rhazes, Galenus, Alexander Aphrodiseus, Platus, Timeus",,,,,,,,,,,,,,,"Nicephori logica, Georgii Valle libellus de argumentis, Hypothesis interpretatio eiusdem libri Euclidis, Nicephorus de astrolabio, Proclus de astrolabio, Aristarchi Sami de magnitudinibus, distantijs solis et lune, Timeus de mundo, Cleonidis musica, Eusebii Pamphili de quibusdam theologicis ambiguitatibus, Cleomedes de mundo, Athenagorae philosophi de resurrectione, Aristotelis de celo, Aristotelis magna ethica, Aristotelis ars poetica, Rhazes de pestilentia, Galenus de inaequali intemperantia, Galenus de bono corporis habitu, Galenus de confirmatione corporis humani, Galenus de pestigura, Galenus de pestagio, Zalchi introductiorium, Galenus de succidanéis, Alexander Aphrodiseus de causis ebriorum, Platus de victu humano",Euclidis quartus decimus elementorum,,,,,,,,,ai_02_13-35,,,"Nicephorus de astrolabio
Proclus de astrolabio
Aristarchi Sami de magnitudinibus
et distantijs solis et lune
Timeus de mundo
Cleonidis musica
Eusebii Pamphili de quibusdam
theologicis ambiguitatibus
Cleomedes de mundo
Athenagorae philosophi de resurrectione
Aristotelis de celo
Aristotelis magna ethica
Aristotelis ars poetica
Rhazes de pestilentia
Galenus de inaequali intemperantia
Galenus de bono corporis habitu
Galenus de confirmatione corporis humani
Galenus de pestigura
Galenus de pestagio
Zalchi introductiorium
Galenus de succidanéis
Alexander Aphrodiseus de causis ebriorum
Platus de victu humano.",,elements,Giorgio Valla,Simon Papiensem,Simon Papiensem,Impressum Venetiis per Simonem Papiensem dictum Beuilaquam. 1498. Die ultimo Septembris Cum gratia et Priuilegio.,,Folio,Elements 14,rendering doesn't work LIRI,,https://www.google.co.il/books/edition/Georgio_Valla_Placentino_interprete_Hoc/EKC8AXlrV30C,https://i.imgur.com/p2M4jJU.png,,,
Venice 1505,1505,Venice,,LATIN,,Bartolomeo Zamberti,Euclidis megarensis philosophi platonicj Mathematicarum disci-plinarum Ianitoris: Habent in hoc volumine quicumque ad mathemat-icam substantiam aspirant: elementorum libros. xiij. cum expositione Theonis insignis mathematici. quibus multa quae deerant ex lectione graeca sumpta addita sub nec non plurima subuersa et prepostere: voluta in Campani interpretatione: ordinata digesta et castigata sunt. Quibus etiam nonnulla ab illo venerando. Socratico philosopho mirando iudicio structa habentur adiuncta. Deputatum scilicet Euclidi volumen. xiiij. cum expositione Hypsi. Alex. Itidemque et Phaeno. Specu. et Perspe. cum expositione Theonis. ac mirandus ille liber Datorum cum expositione Pappi Mechanici vna cum Marini dialectici protheoria. Bar. Zamber. Vene. Interprete. Cum grat¯ıa et Priuilegio per decennium.,"Euclid of Megara, a Platonic philosopher, the gatekeeper of mathematical disciplines: In this volume, those who aspire to the substance of mathematics will find: thirteen books of the Elements, with the exposition of Theon, a distinguished mathematician. Many things that were missing have been added, taken from the Greek reading, and not a few have been overturned and improperly handled in Campanus's interpretation; they have been arranged, organized, and corrected. To these are also added some things constructed by that venerable Socratic philosopher with admirable judgment. Namely, the fourteenth book attributed to Euclid, with the exposition of Hypsicles of Alexandria. Likewise, Phaenomena, Optics, and Catoptrics with the exposition of Theon, and that marvelous book of Data with the exposition of Pappus the Mechanic, together with the protheoria of Marinus the Dialectician. Bartholomew Zamberti of Venice, Interpreter. With grace and privilege for a decade.",Euclidis megarensis philosophi platonicj,Bar. Zamber. Vene.,,Interprete,,"Euclidis, Euclidi",megarensis philosophi platonicj Mathematicarum disci-plinarum Ianitoris,Socratico philosopho,"Theonis, Campani, Hypsi. Alex., Pappi Mechanici, Marini dialectici",,,,Cum grat¯ıa et Priuilegio per decennium,"aspirant, sumpta, addita, subuersa, voluta, ordinata, digesta, castigata, habentur, adiuncta",graeca,,,,mathemat-icam substantiam aspirant,,,,"expositione Theonis insignis mathematici, multa quae deerant ex lectione graeca sumpta addita, plurima subuersa et prepostere: voluta in Campani interpretatione: ordinata digesta et castigata, nonnulla ab illo venerando. Socratico philosopho mirando iudicio structa","expositione Theonis, expositione Hypsi. Alex., Phaeno. Specu. et Perspe., expositione Theonis, liber Datorum, expositione Pappi Mechanici, Marini dialectici protheoria",elementorum libros. xiij.,,,,,,,,,ai_02_13-35,,,elementorum libros. xiij. cum expositione Theonis insignis mathematici. quibus multa quae deerant ex lectione graeca sumpta addita sub nec non plurima subuersa et prepostere: voluta in Campani interpretatione: ordinata digesta et castigata sunt. Quibus etiam nonnulla ab illo venerando. Socratico philosopho mirando iudicio structa habentur adiuncta. Deputatum scilicet Euclidi volumen. xiiij. cum expositione Hypsi. Alex. Itidemque et Phaeno. Specu. et Perspe. cum expositione Theonis. ac mirandus ille liber Datorum cum expositione Pappi Mechanici vna cum Marini dialectici protheoria.,,elements,Bartolomeo Zamberti,Ioannis Tacuini,Ioannis Tacuini,Impressum Venetiis fœlicibus auibus opus est huiusmodi aureum & rarissimum: in aedibus Ioannis Tacuini librarii accuratissima dilligentia recognitum. Anno reconciliatæ diuinitatis. M.D.V. VIII. Klendas nouembris. Auspiciis fœlicissimæ Venetorum. Re. Pu. Leor-nadi Lauretani: Principis sapientissimi: Cautum est tamen dominii sanctione: ne quis presens opus Venetiis cudat: aut alibi impressum uendere audeat: mulcta adiuncta ut in Priui. pressius legitur.,,Folio,Elements 1–15; Phaenomena; Optica; Catoptrica; Data,,,https://www.google.co.il/books/edition/Euclidis_megare_n_sis_philosophi_platoni/8TEeimGzcfAC,https://i.imgur.com/Osjjp2a.png,,,
Frankfurt 1506,1506,Frankfurt,,LATIN,,Ambrosius Lacher,?,The most illustrious book of the elements of the most perceptive Euclid. in the art of Geometry begins most happily,Preclarissimus liber elementorum Euclidis,,,,,Euclidis,perspicacissimi,,,,,,,,,,,,,,,,,,,,,,,,,,,mia,perspicacissimi,,in artem Geometrie incipit quamfoelicissime,,elements,Ambrosius Lacher,,,Et tantum de quatuor libris elementorum Euclidis cum fa-miliari Campani in eosdem comentario. qui cum in omnibus vniuer-salibus studijs ordinaria institucione preeleguntur sic eciam in hac nos-tra achademia franckfordiana. ab illustrissimis Ioachim principe elec-tore et Alberto germanj marchionibus Brandeburgj nuper erecta. per Mgrm Ambrosium lacher de Merspurg mathematicum ibidemque Colle-giatum accurata diligencia lecti castigati propriisque impensis elaborati sunt atque impressi ut athenarum more studium philosophie a mathe-matico splendore mirifice inceptum efflorescat Anno salutis. vi.,,Quarto,Elements 1–4,"I suspect this is not a title page, but only a title. From eip: ""Preclarissimus liber elementorum Euclidis perspicacissimi. in artem Geometrie incipit quamfoelicissime""",,,,,,
Venice 1509,1509,Venice,,LATIN,,Luca Pacioli,"Euclidis megarensis philosophi acutissimi mathematicorumque omnium sine controuersia principis opera a Campano interprete fidissimo tralata Que cum antea librariorum detestanda culpa mendis fedissimis adeo deformia essent: vt vix Euclidem ipsum agnoscere-mus. Lucas paciolus theologus insignis: altissima Mathematicarum disciplinarum scientia rarissimus iudicio castigatissimo detersit: emen-dauit. Figuras centum et vndetriginta que in alijs codicibus inuerse et deformate erant: ad rectam symmetriam concinnauit: et multas necessarias addidit. Eundem quoque plurimis locis intellectu diicilem commentariolis sane luculentis et eruditiss. aperuit: enarrauit: illustrauit Adhec vt elimatior exiret Scipio vegius mediol. vir vtraque lingua: arte medica: sublimioribusque studijs clarissimus diligentiam: et censuram
suam prestitit.","The works of Euclid of Megara, the most acute philosopher and without controversy the prince of all mathematicians, translated by Campanus, the most faithful interpreter. These works, which previously, due to the deplorable fault of scribes, were so deformed by the most foul errors that we could scarcely recognize Euclid himself. Lucas Pacioli, a distinguished theologian, exceedingly rare in the highest knowledge of mathematical disciplines, with the most discerning judgment, cleansed and corrected them. He arranged one hundred and thirty-nine figures, which in other manuscripts were inverted and deformed, into correct symmetry and added many necessary ones. In many places, he also elucidated, explained, and illustrated the same work, which was difficult to understand, with very clear and most learned commentaries. Moreover, so that it might emerge more refined, Scipio Vegius of Milan, a man renowned in both languages, the medical art, and higher studies, provided his diligence and critique.",Euclidis megarensis philosophi,Lucas paciolus,Campano,theologus insignis: altissima Mathematicarum disciplinarum scientia rarissimus iudicio castigatissimo detersit: emen-dauit,interprete fidissimo,"Euclidis, Euclidem",megarensis philosophi acutissimi mathematicorumque omnium sine controuersia principis,,Scipio vegius mediol,,,,,"tralata, detersit, emen-dauit, concinnauit, addidit, aperuit, enarrauit, illustrauit",,,,,,,,,"Figuras centum et vndetriginta que in alijs codicibus inuerse et deformate erant: ad rectam symmetriam concinnauit: et multas necessarias addidit., commentariolis sane luculentis et eruditiss.",,,,,Paganius Paganinus,,,,,,ai_02_14-55,Que cum antea librariorum detestanda culpa mendis fedissimis adeo deformia essent: vt vix Euclidem ipsum agnoscere-mus,Figuras centum et vndetriginta que in alijs codicibus inuerse et deformate erant: ad rectam symmetriam concinnauit: et multas necessarias addidit. Eundem quoque plurimis locis intellectu diicilem commentariolis sane luculentis et eruditiss. aperuit: enarrauit: illustrauit,"Adhec vt elimatior exiret Scipio vegius mediol. vir vtraque lingua: arte medica: sublimioribusque studijs clarissimus diligentiam: et censuram
suam prestitit",,elements,Luca Pacioli,Paganinus de Paganinis,Paganinus de Paganinis,"Euclidis megarensis philosophi perspicacissimi elemen-torum opus de duabus quantitatibus discreta scilicet et continua. ac earundem proportionibus et proportionalitatibus: ex optima Campani interpretatione. Magistro Luca paciolo de Burgo Sancti Sepulchri Ordinis Minorum sacre theologie professore. Matematiceque discipline cultore feruentissimo die noctuque chalcographis asistente postillis suis oportunis plerisque in locis additis manu propria accuratissime castigatum finit.
Venetiis impressum per probum Virum Paganinum de Paganinis de Brixia decreto tamen publico vt nullus ibidem totique dominio annorum .xv. curriculo imprimat aut imprimere faciat. et alibi impres-sum sub quouis colore in publicum ducat sub penis in dicto priuilegio contentis Anno redemptionis nostre .M.D.VIIII. Klen .XI. Iunii. Leonardo Lauretano Ve. Re. Pu. Gubernante. Pontificatus Iulii .II. Anno .VI.",A. Paganius Paganinus Characteribus elegantissimis accu-ratissime imprimebat.,Folio in 8s,Elements 1–15,,,https://www.google.co.il/books/edition/Euclidis_Megarensis_Opera/9mdY8sZcUa4C,https://i.imgur.com/qz362Fw.png,,,A. Paganius Paganinus was printing with the most elegant characters very accurately.
