Strasbourg 1564b,1564,Strasbourg,,LATIN,,Conrad Dasypodius,"PROPOSITIOnes reliquorum Librorum Geometriæ Euclidis, Græcè, & Latinè, in vsum eorum, qui volumine Euclidis carent. Per Cunradum Dasypodium, scholæ Argentinensis professorem.","PROPOSITIOnes of the remaining Books of Euclid's Geometry, in Greek & Latin, for the use of those who lack the volume of Euclid. By Cunradus Dasypodius, professor of the Strasbourg school.",PROPOSITIOnes reliquorum Librorum Geometriæ Euclidis,Cunradum Dasypodium,,scholæ Argentinensis professorem,,Euclidis,,,,,,,,,"Græcè, Latinè",,,,"in vsum eorum, qui volumine Euclidis carent",,,scholæ Argentinensis,,,Librorum Geometriæ Euclidis,,M. D. LXIIII.,Christianum Mylium,ARGENTORATI,,,,,ai_02_14-55,,,"Græcè, & Latinè, in vsum eorum, qui volumine Euclidis carent",,elements,Conrad Dasypodius,Christianum Mylium,Christian Mehl,,ARGENTORATI APVD Christianum Mylium. M. D. LXIIII.,Octavo,Elements 3–13 (enunciations),,,https://www.google.co.il/books/edition/Propositiones_reliquorum_Librorum_Geomet/NU3IO_IPGh8C,https://i.imgur.com/wb7mwSd.png,,,ARGENTORATI AT Christian Mylius. 1564.
Strasbourg 1566,1566,Strasbourg,,GREEK,LATIN,"Conradus Dasypodius, Christian Herlin","ANALYSEIS GEOmetricæ sex librorum Euclidis. PRIMI ET QVINTI FACTAE À CHRISTIANO HERLINO: RELIQUAE VNÀ
CVM COMmentariis, & Scholiis perbreuibus in eosdem sex libros Geometricos: à Cunrado Dasypodio. CVM Indice Πορισ[lάτων καl λη[l[lάτων: item aliarum rerum atque uerborum memorabilium. PRO SCHOLA ARGENTINENSI.","ANALYSIS OF THE GEOMETRIC Books of Euclid. THE FIRST AND FIFTH MADE BY CHRISTIAN HERLIN: THE REMAINING TOGETHER WITH COMMENTARIES, & Brief Notes on the same six Geometric books: by Conrad Dasypodius. WITH AN INDEX OF Propositions and Lemmas: also of other memorable things and words. FOR THE STRASBOURG SCHOOL.",ANALYSEIS GEOmetricæ sex librorum Euclidis.,CHRISTIANO HERLINO,Cunrado Dasypodio,,,Euclidis,,,,,,,,FACTAE,,,,,PRO SCHOLA ARGENTINENSI.,,,SCHOLA ARGENTINENSI,"ANALYSEIS GEOmetricæ, COMMENTARIIS, Scholiis perbreuibus, Indice Πορισ[lάτων καl λη[l[lάτων: item aliarum rerum atque uerborum memorabilium",,sex librorum Euclidis,,M.D.LXVI.,IOSIAS RIHELIVS,,CVM Gratia & Priuilegio Cæsareo ad annos octo.,,,,ai_02_14-55,PRIMI ET QVINTI FACTAE À CHRISTIANO HERLINO,"RELIQUAE VNÀ
CVM COMmentariis, & Scholiis perbreuibus in eosdem sex libros Geometricos",CVM Indice Πορισ[lάτων καl λη[l[lάτων: item aliarum rerum atque uerborum memorabilium,PRO SCHOLA ARGENTINENSI,elements,"Conradus Dasypodius, Christianus Herlinus",IOSIAS RIHELIVS,Josias Rihel,,CVM Gratia & Priuilegio Cæsareo ad annos octo. EX-CVDEBAT IOSIAS RIHELIVS. M.D.LXVI.,Quarto,Elements 1–6,,,https://www.google.co.il/books/edition/Analyseis_geometric%C3%A6_sex_librorum_Eucli/BGXs-wxO3aIC,https://i.imgur.com/2v9FqDK.png,,,With the Grace & Privilege of the Emperor for eight years. PRINTED BY JOSIAS RIHELIUS. 1566.
Strasbourg 1564a,1564,Strasbourg,,GREEK,LATIN,Conrad Dasypodius,"ΕΥΚΛΕΙΔΟΥ
ΤΩΝ ΠΕΝΤΕ ΚΑΙ ΔΕΚΑ ΣΤΟΙ-
ΧΕΙΩΝ ΕΚ ΤΩΝ ΤΟΥ ΘΕΩΝΟΣ
συνουσιῶν τὸ δεύτερον.

Καὶ
ΒΑΡΛΑΑΜ ΜΟΝΑΧΟΥ ΑΡΙΘΜΗ-
τικὴ ἀπόδειξις τῶν γεωμετρικῶς ἐν τῷ
δευτέρῳ τῶν στοιχείων ἀπο-
δεχθέντων.

Id est,
EVCLIDIS QVINDECIM
elementorum Geometriae secundù: ex
Theonis commentarijs
Graecè, & Latinè.

Item,
Barlaam monachi Arithmetica demonſtra-
tio eorum, quae in secundo libro elementorum
sunt in lineis & figuris planis
demonstrata.

Item,
Octo propositiones Stereometricae, eiusdem cum præ-
cedentibus argumenti. Per Cunradum Da=
ſypodium, scholae Argentinæ=
ſis Professorem.","OF EUCLID
THE FIFTEEN ELEMENTS
compiled from the writings of Theon
the second edition.

And
THE MONK BARLAAM’S
arithmetical demonstration of the geometrical
propositions accepted in the
second book of the Elements.

That is,
THE FIFTEEN BOOKS
of Euclid’s Elements of Geometry: according to
the commentaries of Theon,
in Greek and Latin.

Also,
An arithmetical demonstration by the monk Barlaam
of those things which, in the second book of the Elements,
are demonstrated in lines and plane figures.

Also,  
Eight propositions of Stereometry, on the same subject as the pre-  
ceding material. By Conrad Dasypodius,  
Professor at the School of Strasbourg.","ΕΥΚΛΕΙΔΟΥ
ΤΩΝ ΠΕΝΤΕ ΚΑΙ ΔΕΚΑ ΣΤΟΙ-
ΧΕΙΩΝ ΕΚ ΤΩΝ ΤΟΥ ΘΕΩΝΟΣ","Cunradum Da=
ſypodium",,"scholae Argentinæ=
ſis Professorem",,ΕΥΚΛΕΙΔΟΥ,,,"Theonis, Barlaam",,,,,demonstrata,"Graecè, Latinè",,,,,"ΕΥΚΛΕΙΔΟΥ
ΤΩΝ ΠΕΝΤΕ ΚΑΙ ΔΕΚΑ ΣΤΟΙ-
ΧΕΙΩΝ ΕΚ ΤΩΝ ΤΟΥ ΘΕΩΝΟΣ
συνουσιῶν τὸ δεύτερον.

Καὶ
ΒΑΡΛΑΑΜ ΜΟΝΑΧΟΥ ΑΡΙΘΜΗ-
τικὴ ἀπόδειξις τῶν γεωμετρικῶς ἐν τῷ
δευτέρῳ τῶν στοιχείων ἀπο-
δεχθέντων.",,"scholae Argentinæ=
ſis",,"ΒΑΡΛΑΑΜ ΜΟΝΑΧΟΥ ΑΡΙΘΜΗ-
τικὴ ἀπόδειξις, Octo propositiones Stereometricae","ΤΩΝ ΠΕΝΤΕ ΚΑΙ ΔΕΚΑ ΣΤΟΙ-
ΧΕΙΩΝ ΕΚ ΤΩΝ ΤΟΥ ΘΕΩΝΟΣ",,M. D. LXIIII.,Christianum Mylium,ARGENTORATI,,,,,ai_02_14-55,,,,,elements,Conrad Dasypodius,Cunradum Dasypodium,Konrad Dasypodius,ARGENTORATI APVD Christianum Mylium. 1564.,ARGENTORATI APVD Christianum Mylium. M. D. LXIIII.,Octavo,Elements 2,,,https://www.google.co.il/books/edition/Propositiones_reliquorum_Librorum_Geomet/NU3IO_IPGh8C,https://i.imgur.com/o79wfa2.png,,,ARGENTORATI AT Christian Mylius. 1564.
Bologna 1651,1651,Bologna,,ITALIAN,,Giovanni Ricci,DE GLI ELEMENTI DI EVCLIDE Li Primi sei Libri Tradotti in lingua Italiana. ALL’ILLVSTRISS. SENATO DI BOLOGNA.,OF THE ELEMENTS OF EUCLID The First Six Books Translated into Italian. TO THE MOST ILLUSTRIOUS SENATE OF BOLOGNA.,DE GLI ELEMENTI DI EVCLIDE Li Primi sei Libri,,,,,EVCLIDE,,,,ALL’ILLVSTRISS. SENATO DI BOLOGNA.,,,,Tradotti,Italiana,,,,,,,SENATO DI BOLOGNA,,,GLI ELEMENTI DI EVCLIDE,,,Gio. Batt. Ferroni,Bologna,Con licenza de’ Superiori,,,,ai_02_14-55,Tradotti in lingua Italiana,,,,elements,Giovanni Ricci,Gio. Batt. Ferroni,Gio. Batt. Ferroni,,"In Bologna, presso Gio. Batt. Ferroni 1651. Con licenza de’ Superiori.",Octavo,Elements 1–6,italiana without dot,-,https://www.google.co.il/books/edition/De_gli_Elementi_di_Euclide_li_primi_sei/gHs-AAAAcAAJ,https://i.imgur.com/sg4Nst7.png,,,"In Bologna, at Gio. Batt. Ferroni 1651. With permission of the Superiors."
Bologna 1651a,1651,Bologna,,ITALIAN,,Giovanni Ricci,DE GLI ELEMENTI DI EVCLIDE Li Primi sei Libri Tradotti in lingua Italiana ALL’ILLVSTRISS. SENATO DI BOLOGNA.,OF THE ELEMENTS OF EUCLID The First Six Books Translated into Italian TO THE MOST ILLUSTRIOUS SENATE OF BOLOGNA.,DE GLI ELEMENTI DI EVCLIDE Li Primi sei Libri,,,,,EVCLIDE,,,,ALL’ILLVSTRISS. SENATO DI BOLOGNA.,,,,Tradotti,Italiana,,,,,,,SENATO DI BOLOGNA,,,GLI ELEMENTI DI EVCLIDE,,,Gioseffo Longhi,Bologna,Con licenza de’ Superiuri,,,,ai_02_14-55,Tradotti in lingua Italiana,,,,elements,Giovanni Ricci,Gioseffo Longhi,Giuseppe Longhi,,"In Bologna, per Gioseffo Longhi. Con licenza de’ Superiuri.",Octavo,Elements 1–6,italiana without dot,-,https://www.google.co.il/books/edition/De_gli_Elementi_di_Euclide_li_primi_sei/gHs-AAAAcAAJ,https://i.imgur.com/PXiXo00.png,,,"In Bologna, for Gioseffo Longhi. With permission of the Superiors."
Amsterdam 1683,1683,Amsterdam,,LATIN,,André Tacquet,"ELEMENTA GEOMETRIÆ PLANÆ AC SOLIDÆ. Quibus
accedunt selecta EX ARCHIMEDE THEOREMATA. Auctore AN-DREA TACQUET SOC. JESU Sacerdote & Matheseos Professore. EDITIO NOVA.","ELEMENTS OF PLANE AND SOLID GEOMETRY. To which
are added selected THEOREMS FROM ARCHIMEDES. By the author AN-DREA TACQUET, PRIEST OF THE SOCIETY OF JESUS & PROFESSOR OF MATHEMATICS. NEW EDITION.",ELEMENTA GEOMETRIÆ PLANÆ AC SOLIDÆ.,AN-DREA TACQUET,,SOC. JESU Sacerdote & Matheseos Professore.,,,,,ARCHIMEDE,,,EDITIO NOVA.,,accedunt,,,,,,,,SOC. JESU,,selecta EX ARCHIMEDE THEOREMATA,ELEMENTA GEOMETRIÆ PLANÆ AC SOLIDÆ.,,M DC LXXXIII.,HENRICUM WETSTENIUM,AMSTELÆDAMI,,,,,ai_02_14-55,,,"Quibus
accedunt selecta EX ARCHIMEDE THEOREMATA",,elements,Andrea Tacquet,Henricum Wetstenium,Henricum Wetstenium,,"AMSTELÆDAMI, Apud HENRICUM WETSTENIUM. M DC LXXXIII.",Octavo,"Elements 1–6, 11–12",,,https://www.google.co.il/books/edition/Elementa_Geometriae_planae/uWEmAAAAcAAJ,https://i.imgur.com/7fgSwnj.png,,,"AMSTERDAM, By HENRY WETSTEN. 1683."
Amsterdam 1701b,1701,Amsterdam,,LATIN,,André Tacquet,"ELEMENTA GEOMETRIÆ PLANÆ AC SOLIDÆ. Quibus
accedunt selecta EX ARCHIMEDE THEOREMATA, Auctore AN-DREA TACQUET, SOC. JESU Sacerd. & Matheseos Professore.","ELEMENTS OF PLANE AND SOLID GEOMETRY. To which
are added selected THEOREMS FROM ARCHIMEDES, by the Author AN-DREA TACQUET, Priest of the SOCIETY OF JESUS & Professor of Mathematics.",ELEMENTA GEOMETRIÆ PLANÆ AC SOLIDÆ.,AN-DREA TACQUET ,,SOC. JESU Sacerd. & Matheseos Professore.,,,,,ARCHIMEDE,,,,,accedunt,,,,,,,,SOC. JESU,,selecta EX ARCHIMEDE THEOREMATA,ELEMENTA GEOMETRIÆ PLANÆ AC SOLIDÆ.,,MDCCI.,FRANCISCUM van der PLAATS,AMSTELÆDAMI,,,,,ai_02_14-55,,,"Quibus
accedunt selecta EX ARCHIMEDE THEOREMATA",,elements,Andrea Tacquet,Franciscus van der Plaats,Franciscus van der Plaats,,"AMSTELÆDAMI, Apud FRANCISCUM van der PLAATS. MDCCI.",Octavo,"Elements 1–6, 11–12",,-,https://www.google.co.il/books/edition/Elementa_Euclidea_geometriae_planae_ac_s/fKk2AAAAMAAJ,https://i.imgur.com/r4BS4Do.png,,,"AMSTERDAM, At FRANCISCUS van der PLAATS. 1701."
Cambridge 1703,1703,Cambridge,,LATIN,,"André Tacquet, William Whiston","V. CL. ANDREÆ TACQUET SOC. JESU Sacerdotis,  &
Matheseωs Professoris ELEMENTA GEOMETRIÆ PLANÆ AC SOLIDÆ,  &  SELECTA  EX  ARCHIMEDE  THEOREMATA.
Quibus in hac nova Editione accedunt COROLLARIA non pauca illustrandis Elementis accommodata, & varios propositionum pluri-marum USUS continentia. Summa cura emendata, & XL Schematibus novis æri incisis illustrata. A GVLIELMO WHISTON, A. M. Math-eseωs Professore LUCASIANO apud CANTABRIGIENSES.","V. CL. ANDREÆ TACQUET OF THE SOCIETY OF JESUS Priest, & Professor of Mathematics ELEMENTS OF PLANE AND SOLID GEOMETRY, & SELECT THEOREMS FROM ARCHIMEDES. To which in this new Edition are added not a few COROLLARIES suited to illustrate the Elements, & containing various applications of many propositions. Corrected with the utmost care, & illustrated with XL new diagrams engraved on copper. By WILLIAM WHISTON, A. M. Lucasian Professor of Mathematics at CAMBRIDGE.","ELEMENTA GEOMETRIÆ PLANÆ AC SOLIDÆ, &  SELECTA  EX  ARCHIMEDE  THEOREMATA.","GVLIELMO WHISTON, A. M.",ANDREÆ TACQUET,Math-eseωs Professore LUCASIANO apud CANTABRIGIENSES.,"SOC. JESU Sacerdotis,  &
Matheseωs Professoris",,,,ARCHIMEDE,,,"Quibus in hac nova Editione accedunt COROLLARIA non pauca illustrandis Elementis accommodata, & varios propositionum pluri-marum USUS continentia. Summa cura emendata, & XL Schematibus novis æri incisis illustrata.",,"accedunt, emendata, illustrata",,,,,,,,"SOC. JESU, CANTABRIGIENSES","COROLLARIA non pauca illustrandis Elementis accommodata, & varios propositionum pluri-marum USUS continentia, XL Schematibus novis æri incisis",SELECTA  EX  ARCHIMEDE  THEOREMATA,ELEMENTA GEOMETRIÆ PLANÆ AC SOLIDÆ,,MDCCIII.,CORN. CROWNFIELD.,CANTABRIGIÆ,,,,,ai_02_14-55,SELECTA  EX  ARCHIMEDE  THEOREMATA,,"Quibus in hac nova Editione accedunt COROLLARIA non pauca illustrandis Elementis accommodata, & varios propositionum pluri-marum USUS continentia",XL Schematibus novis æri incisis illustrata,elements,"Andrea Tacquet, William Whiston",CORN. CROWNFIELD,CORN. CROWNFIELD,,"CANTABRIGIÆ, TYPIS ACADEMICIS. Impensis CORN. CROWNFIELD. MDCCIII.",Octavo,"Elements 1–6, 11-12",,,https://www.google.co.il/books/edition/Elementa_geometri%C3%A6_plan%C3%A6_ac_solid%C3%A6_Eu/9gHKKwQnFngC,https://i.imgur.com/pb5q7da.png,,,"CAMBRIDGE, ACADEMIC PRESS. At the expense of CORN. CROWNFIELD. 1703."
Rome 1574,1574,Rome,,LATIN,,Christopher Clavius,"[vol. 1]:	EVCLIDIS  ELEMENTORVM LIBRI  XV.  ACCES-
SIT XVI. DE SOlidorum Regularium comparatione.	OMNES
PERSPICVIS DEmonstrationibus, accuratisque scholijs illustrati. AVCTORE CHRISTOPHORO CLAVIO BAMBERGENSI. SOCI-ETATIS IESV.
[vol. 2]: EVCLIDIS POSTERIORES Libri sex a x. ad xv. AC-CESSIT XVI. DE SOlidorum Regularium comparatione. OMNES PERSPICVIS DEmonstrationibus, accuratisque scholijs illustrati. AVCTORE CHRISTOPHORO CLAVIO BAMBERGENSI. SOCI-ETATIS IESV.","[vol. 1]: THE ELEMENTS OF EUCLID BOOKS XV. WITH AN ADDITIONAL XVI. ON THE COMPARISON OF REGULAR SOLIDS. ALL ILLUSTRATED WITH CLEAR DEMONSTRATIONS AND ACCURATE SCHOLIA. BY CHRISTOPHER CLAVIUS OF BAMBERG. OF THE SOCIETY OF JESUS.
[vol. 2]: THE LATER BOOKS OF EUCLID FROM X. TO XV. WITH AN ADDITIONAL XVI. ON THE COMPARISON OF REGULAR SOLIDS. ALL ILLUSTRATED WITH CLEAR DEMONSTRATIONS AND ACCURATE SCHOLIA. BY CHRISTOPHER CLAVIUS OF BAMBERG. OF THE SOCIETY OF JESUS.",EVCLIDIS  ELEMENTORVM LIBRI  XV.,CHRISTOPHORO CLAVIO BAMBERGENSI.,,SOCIE-TATIS IESV.,,EVCLIDIS,,,,,,,,illustrati,,,,,,,,"SOCI-ETATIS IESV, SOCI-ETATIS IESV","PERSPICVIS DEmonstrationibus, accuratisque scholijs",DE SOlidorum Regularium comparatione,EVCLIDIS  ELEMENTORVM LIBRI  XV.,,1574,Vincentium Accoltum,ROMAE,,,,,ai_02_14-55,"OMNES PERSPICVIS DEmonstrationibus, accuratisque scholijs illustrati","OMNES
PERSPICVIS DEmonstrationibus, accuratisque scholijs illustrati.",EVCLIDIS POSTERIORES Libri sex a x. ad xv.,AC-CESSIT XVI. DE SOlidorum Regularium comparatione.,elements,Christoph Clavius,Vincentium Accoltum,Vincentium Accoltum,"[vol. 2] ROMAE, Apud Vincentium Accoltum. M.D.LXXIIII. Cum licentia Superiorum.","[vols 1 & 2] ROMAE, Apud Vincentium Accoltum. 1574.","Two volumes, octavo",Elements 1–16,,https://www.ustc.ac.uk/editions/828480,https://hdl.handle.net/2027/ucm.5316864701,https://i.imgur.com/JpcQSVc.jpeg,,,"[vols 1 & 2] ROME, At Vincentius Accoltus. 1574."
Cologne 1607,1607,Cologne,,LATIN,,"Jean Magnien, Étienne Gracile","EVCLIDIS ELEMENTORVM LIBRI XV. ACCESSIT LIBER
XVI. DE QVINQVE SOLIDORVM REGVLARIVM inter se com-
paratione. AD EXEMPLARIA R.P. CHRISTOphori Clauij è Societ. IESV, & aliorum collati, emendati & aucti.","THE FIFTEEN BOOKS OF EUCLID'S ELEMENTS. THERE IS ALSO A SIXTEENTH BOOK ON THE COMPARISON OF THE FIVE REGULAR SOLIDS with each other. COMPARED, CORRECTED, AND ENLARGED ACCORDING TO THE COPIES OF R.P. CHRISTOPHER CLAVIUS OF THE SOCIETY OF JESUS, & OTHERS.",EVCLIDIS ELEMENTORVM LIBRI XV,,,,,EVCLIDIS,,,R.P. CHRISTOphori Clauij,,,"AD EXEMPLARIA R.P. CHRISTOphori Clauij è Societ. IESV, & aliorum collati, emendati & aucti",,"collati, emendati, aucti",,,,,,,,Societ. IESV,"AD EXEMPLARIA R.P. CHRISTOphori Clauij è Societ. IESV, & aliorum collati, emendati & aucti",LIBER XVI. DE QVINQVE SOLIDORVM REGVLARIVM inter se com- paratione,,,M. D. CVII.,Gosuinum Cholinum,COLONIAE,Cum Gratia & Priuilegio.,,,,ai_02_14-55,"AD EXEMPLARIA R.P. CHRISTOphori Clauij è Societ. IESV, & aliorum collati, emendati & aucti",,"ACCESSIT LIBER
XVI. DE QVINQVE SOLIDORVM REGVLARIVM inter se com-
paratione",,elements,Gracilis/Magnienus,Gosuinum Cholinum,Goswinus Cholinus,,COLONIAE Apud Gosuinum Cholinum M. D. CVII. Cum Gratia & Priuilegio.,Octavo,Elements 1–16 (enunciations),,,https://www.google.co.il/books/edition/Antonii_Possevini_Mantvani_Societatis_Ie/yqWtNTuCDvgC,https://i.imgur.com/pX0xlv8.png,,,COLONIAE At Gosuinus Cholinus 1607. With Grace & Privilege.
Cologne 1627,1627,Cologne,,LATIN,,"Jean Magnien, Étienne Gracile","EVCLIDIS ELEMENTORVM LIBRI XV. ACCESSIT LIBER
XVI. DE QVINque solidorum Regularium inter se comparatione. AD EXEMPLARIA R.P. CHRISTOphori Clauij è Societ. IESV, & aliorum hac postrema editione collati, emendati & aucti.","THE FIFTEEN BOOKS OF EUCLID'S ELEMENTS. THERE IS ADDED A SIXTEENTH BOOK ON THE COMPARISON OF THE FIVE REGULAR SOLIDS AMONG THEMSELVES. COMPARED, CORRECTED, AND ENLARGED IN THIS LATEST EDITION ACCORDING TO THE COPIES OF R.P. CHRISTOPHER CLAVIUS OF THE SOCIETY OF JESUS, AND OTHERS.",EVCLIDIS ELEMENTORVM LIBRI XV,,,,,EVCLIDIS,,,R.P. CHRISTOphori Clauij,,,"AD EXEMPLARIA R.P. CHRISTOphori Clauij è Societ. IESV, & aliorum hac postrema editione collati, emendati & aucti",,"collati, emendati, aucti",,,,,,,,Societ. IESV,"AD EXEMPLARIA R.P. CHRISTOphori Clauij è Societ. IESV, & aliorum hac postrema editione collati, emendati & aucti",LIBER XVI. DE QVINque solidorum Regularium inter se comparatione,,,M. DC. XXVII.,Petrum Cholinum,COLONIAE,Cum gratia & Priuilegio.,,,,ai_02_14-55,"AD EXEMPLARIA R.P. CHRISTOphori Clauij è Societ. IESV, & aliorum hac postrema editione collati, emendati & aucti",,"ACCESSIT LIBER
XVI. DE QVINque solidorum Regularium inter se comparatione",,elements,Gracilis/Magnienus,Petrus Cholinus,Petrus Cholinus,,COLONIAE Apud Petrum Cholinum M. DC. XXVII. Cum gratia & Priuilegio.,Octavo,Elements 1–16,,-,https://www.google.co.il/books/edition/Elementa/vns-AAAAcAAJ,https://i.imgur.com/mlnY3io.png,,,COLOGNE At Peter Cholinus 1627. With grace & Privilege.
Lyon 1660,1660,Lyon,,LATIN,,Claude-François Milliet Dechales,"EVCLIDIS ELEMENTORVM Libri octo. Ad faciliorem captum accommodati.  AVCTORE P. CLAVDIO FRANCISCO MILLIET
DECHALES, Camberiensi Societ. IESV.","THE ELEMENTS OF EUCLID
Eight Books. Adapted for easier understanding.
BY THE AUTHOR P. CLAUDIUS FRANCISCUS MILLIET
DECHALES, of the Society of JESUS in Chambéry.",EVCLIDIS ELEMENTORVM Libri octo,"P. CLAVDIO FRANCISCO MILLIET
DECHALES",,Camberiensi Societ. IESV,,,,,,,,,,,,,,,,,,Societ. IESV,Ad faciliorem captum accommodati,,,,M. DC. LX.,BENEDICTVM CORAL,LVGDVNI,Cum Priuilegio Regis,,,,ai_02_14-55,Ad faciliorem captum accommodati,,,,elements,Claude-François Milliet Dechales,Benedictum Coral,Benedictum Coral,,"LVGDVNI, Apud BENEDICTVM CORAL, in vico Mer-catorio. M. DC. LX. Cum Priuilegio Regis.",Octodecimo,"Elements 1–6, 11–12",,,,,,,"LVGDVNI, At BENEDICTVM CORAL, in the Mer-catorio street. M. DC. LX. With the Privilege of the King."
Lyon 1675,1675,Lyon,,LATIN,,Claude-François Milliet Dechales,"ELEMENTORUM EUCLIDIS LIBRI OCTO, Ad faciliorem cap-tum accommodati. AUTHORE P. CLAVDIO FRANCISCO MIL-LIET DECHALES, Camberiensi, Societ. JESU. TERTIA EDITIO. Cæteris facilior & correctior.","THE EIGHT BOOKS OF EUCLID'S ELEMENTS, Adapted for easier comprehension. BY THE AUTHOR P. CLAUDE FRANÇOIS MILLIET DECHALES, of Chambéry, Society of JESUS. THIRD EDITION. Easier and more corrected than the others.",ELEMENTORUM EUCLIDIS LIBRI OCTO,P. CLAVDIO FRANCISCO MIL-LIET DECHALES,,"Camberiensi, Societ. JESU.",,EUCLIDIS,,,,,,TERTIA EDITIO. Cæteris facilior & correctior.,,accommodati,,,,,,,,Societ. JESU,"Ad faciliorem cap-tum accommodati, Cæteris facilior & correctior",,ELEMENTORUM EUCLIDIS LIBRI OCTO,,M. DC. LXXV.,BENEDICTI CORAL,LVGDVNI,Cum Superio-rum Permissu.,,,,ai_02_14-55,Ad faciliorem cap-tum accommodati,,,,elements,Claude-François Milliet Dechales,,,,"LVGDVNI, Sumptib. VIDVÆ BENEDICTI CORAL, in
vico Mercatorio sub signo Victoriæ. M. DC. LXXV. Cum Superio-rum Permissu.",Sexto,"Elements 1–6, 11–12",link: https://www.ustc.ac.uk/editions/6078994 - not sure why not in our collection...,,,https://i.imgur.com/grRdhSw.png,,,"LVGDVNI, Sumptib. WIDOW OF BENEDICT CORAL, in
the Merchant Street under the sign of Victory. 1675. With the Permission of the Superiors."
Frankfurt 1674,1674,Frankfurt,,LATIN,,Gaspar Schott,"P. GASPARIS SCHOTTI REGISCURIANI E SOCIET. JESU
Olim in Panormitano Siciliæ, nunc in Herbipolitano Franconiæ ejusdem SOCIETATIS JESU Gymnasio Matheseos Professoris CURSUS MATHEMATICUS, SIVE ABSOLUTA OMNIUM MATHEMATICARUM DISCIPLINARUM ENCYCLOPÆDIA, In
Libros XXVIII. digesta, eoque ordine disposita, ut quivis, vel mediocri præditus ingenio, totam Mathesin à primis fundamentis proprio Marte addiscere possit. Opus desideratum diu, promissum à multis, à non paucis tentatum, à nullo numeris omnibus absolutum. Accesserunt in fine THEORESES MECHANICÆ NOVÆ Additis Indicibus locupletissimis.","P. GASPARIS SCHOTTI REGISCURIANI OF THE SOCIETY OF JESUS
Formerly in the Panormitan of Sicily, now in the Herbipolitan of Franconia of the same SOCIETY OF JESUS, Professor of Mathematics in the Gymnasium MATHEMATICAL COURSE, OR COMPLETE ENCYCLOPEDIA OF ALL MATHEMATICAL DISCIPLINES, Arranged in 28 Books, and disposed in such order that anyone, even with mediocre talent, can learn the whole of Mathematics from the very foundations by their own effort. A work long desired, promised by many, attempted by not a few, completed by none in all respects. At the end, NEW MECHANICAL THEOREMS have been added, along with very comprehensive indexes.",CURSUS MATHEMATICUS,GASPARIS SCHOTTI,,P.,"REGISCURIANI E SOCIET. JESU
Olim in Panormitano Siciliæ, nunc in Herbipolitano Franconiæ ejusdem SOCIETATIS JESU Gymnasio Matheseos Professoris",,,,,,,,,,,,,,"ut quivis, vel mediocri præditus ingenio, totam Mathesin à primis fundamentis proprio Marte addiscere possit.",,,"SOCIET. JESU, Panormitano Siciliæ, Herbipolitano Franconiæ, SOCIETATIS JESU Gymnasio",Indicibus locupletissimis,,none,,ANNO M DC LXXIV.,JOANNIS ARNOLDI CHOLINI,FRANCOFURTI AD MOENUM,Cum Privilegio Sacræ Cæsareæ ac Regiæ Majestatis.,,,,ai_02_14-55,,,,,elements,Caspar Schott,Joannis Arnoldi Cholini,Johann Arnold Cholini,,"Cum Privilegio Sacræ Cæsareæ ac Regiæ Majestatis. FRANCOFURTI AD MOENUM, Sumptibus JOANNIS ARNOLDI CHOLINI. ANNO M DC LXXIV.",Folio,Elements 1–6,,,,https://i.imgur.com/3trOOP8.png,,,"With the Privilege of the Holy Imperial and Royal Majesty.  
FRANKFURT AM MAIN,  
At the expense of JOHANN ARNOLD CHOLIN.  
YEAR 1674."
Rome 1589,1589,Rome,,LATIN,,Christopher Clavius,"[vol. 1]: EVCLIDIS ELEMENTORVM LIB. XV ACCESSIT XVI.
DE SOLIDORVM. Regularium cuiuslibet intra quodlibet compa-ratione. OMNES PERSPICVIS DEMONstrationibus, accuratisque scholijs illustrati: nunc iterum editi, ac multarum rerum accessione locupletati: AVCTORE CHRISTOPHORO CLAVIO BAMBER-GENSI È SOCIETATE IESV
[vol. 2]: EVCLIDIS POSTERIORES LIB. IX ACCESSIT XVI. DE
SOLIDORVM. Regularium cuiuslibet intra quodlibet comparatione. OMNES PERSPICVIS DEMONstrationibus, accuratisque scholijs illustrati: nunc iterum editi, ac multarum rerum accessione locupletati: AVCTORE CHRISTOPHORO CLAVIO BAMBERGENSI È SO-CIETATE IESV","[vol. 1]: EUCLID'S ELEMENTS BOOK XV WITH AN ADDITION OF XVI.
ON THE COMPARISON OF ANY REGULAR SOLIDS WITHIN ANY OTHER. ALL ILLUSTRATED WITH CLEAR DEMONstrations and accurate scholia: now published again, enriched with the addition of many things: BY CHRISTOPHER CLAVIUS OF BAMBERG FROM THE SOCIETY OF JESUS
[vol. 2]: EUCLID'S LATER BOOKS IX WITH AN ADDITION OF XVI. ON THE
COMPARISON OF ANY REGULAR SOLIDS WITHIN ANY OTHER. ALL ILLUSTRATED WITH CLEAR DEMONstrations and accurate scholia: now published again, enriched with the addition of many things: BY CHRISTOPHER CLAVIUS OF BAMBERG FROM THE SO-CIETY OF JESUS",EVCLIDIS ELEMENTORVM LIB. XV ACCESSIT XVI.,CHRISTOPHORO CLAVIO BAMBERGENSI,,È SOCIETATE IESV,,EVCLIDIS,,,,,,"nunc iterum editi, ac multarum rerum accessione locupletati",,"illustrati, editi, ,  locupletati",,,,,,,,SOCIETATE IESV,"OMNES PERSPICVIS DEMONstrationibus, accuratisque scholijs illustrati",DE SOLIDORVM. Regularium cuiuslibet intra quodlibet compa-ratione,ELEMENTORVM,,M D L XXXIX,BARTHOLOMAEVM Grassium,ROMÆ,PERMISSV SVPERIORVM,,,,ai_02_14-55,"OMNES PERSPICVIS DEMONstrationibus, accuratisque scholijs illustrati",,"ACCESSIT XVI.
DE SOLIDORVM. Regularium cuiuslibet intra quodlibet compa-ratione","nunc iterum editi, ac multarum rerum accessione locupletati",elements,Christoph Clavius,,,"[vol. 1 & 2] ROMAE, Apud Sanctium, & Soc. M. D. LXXXIX.",[Vol. 1 & 2] ROMÆ APVD BARTHOLOMAEVM Grassium; M D L XXXIX. PERMISSV SVPERIORVM.,"Two volumes, octavo",Elements 1–16,,,https://www.google.co.il/books/edition/Euclidis_Elementorum_Lib_XV/MD6SRC7r204C,https://i.imgur.com/5X6Wsub.png,,,[Vol. 1 & 2] IN ROME AT BARTHOLOMAEUS Grassium; 1539. WITH PERMISSION OF THE SUPERIORS.
